course_link,course_name,instructor,old_price,new_price,number_of_students,rating,sections,lectures,duration,what_you_learn,tags
https://unica.vn/bung-no-doanh-so-voi-facebook-marketing,Bùng nổ doanh số với facebook marketing,Phạm Thiệp,1.200.000,399.000,1303,2.5,6 phần,34 bài giảng,04 giờ 08 phút,"Tự tin phân tích sản phẩm và khách hàng. Viết nội dung quảng cáo hấp dẫn cho sản phẩm. Thiết lập quảng cáo, quy trình set quảng cáo hoàn thiện. Có thể làm việc tại các doanh nghiệp ở vị trí marketing Facebook. Doanh số bán hàng gia tăng vượt trội so với nhưng tháng trước. Tối ưu chi phí quảng cáo thấp nhất",Facebook Marketing
https://unica.vn/cong-cu-pr,Công cụ PR,Phan Vĩnh Phúc,600.000,459.000,1643,4.2,3 phần,24 bài giảng,03 giờ 09 phút,"Nắm được PR là gì và tầm quan trọng của PR. Nắm được truyền thông tích hợp IMC, từ đó xây dựng chiến lược IMC hiệu quả nhất cho PR. Biết cách xác định đối tượng, mục tiêu và động cơ thông tin để PR hiệu quả có hiệu ứng tốt. Biết cách sử dụng linh hoạt giữa các công cụ PR và công cụ tác động đến các đối tượng khác: báo chí truyền thông, quản lý, công chúng.... Biết cách viết báo chí để PR hiệu quả, thông minh. Tích lũy cho bản thân những bài học PR từ người đi trước và từ giảng viên. Tự tin xử lý các điểm nóng báo chi truyền thông.",Marketing Online
https://unica.vn/65-ky-nghe-facebook-marketing,65 Kỹ nghệ Facebook Marketing,Kiều Văn Đức,800.000,399.000,593,4.8,13 phần,66 bài giảng,08 giờ 23 phút,"Trở thành chuyên gia trong ngành hàng của bạn.. Tự chạy quảng cáo Facebook hiệu quả.. Tiết kiệm ngân sách Marketing, gia tăng doanh số.. Biết được các mẹo quảng cáo hay nhất.. Tối ưu ngân sách quảng cáo.. Biết viết content chất lượng.","Facebook Marketing, Marketing Online"
https://unica.vn/chien-luoc-marketing-dich-vu-hoan-hao,Chiến lược Marketing dịch vụ hoàn hảo,Nguyễn Quỳnh Hoa,500.000,399.000,25,5.0,2 phần,31 bài giảng,04 giờ 15 phút,"Hiểu thế nào là Marketing, Marketing dịch vụ và tầm quan trọng của marketing dịch vụ trong thị trường. Biết cách xác định lợi thế cạnh tranh của doanh nghiệp so với các đối thủ. Biết cách làm Marketing Mix 7P hoàn hảo. Biết cách xử lý sự cố dịch vụ  trong quá trình làm m. Định hướng thị trường, đưa ra chiến lược Marketing phù hợp nhất. Đưa sản phẩm dịch vụ của doanh nghiệp đến tay người tiêu dùng",Chiến lược Marketing
https://unica.vn/tron-bo-bi-quyet-marketing-zalo,Trọn bộ bí quyết Marketing Zalo,Mai Trung Đức,800.000,599.000,166,3.8,7 phần,32 bài giảng,02 giờ 33 phút,"Hiểu rõ tư duy quảng cáo trên Zalo và nắm bắt các công cụ để tiếp cận khách hàng trong Zalo một cách hiệu quả nhất. Hiểu rõ cơ chế bán hàng trên Zalo bằng free traffic. Biết cách thiết lập Zalo OA chuẩn nhất từ đầu. Học cách tận dụng tối đa các tính năg của Zalo OA để tương tác, chăm sóc khách hàng. Nắm rõ các bước tạo và tối ưu các tùy chỉnh trong Zalo Shop để bán hàng. Thuần thục cách thiết lập quảng cáo Zalo phù hợp với mục đích kinh doanh. Nắm bắt các chỉ số quan trọng và biết cách tối ưu quảng cáo Zalo.",Zalo Marketing
https://unica.vn/dao-tao-ky-nang-viet-bai-website-tu-a-z,Đào tạo kỹ năng Content viết bài website từ A-Z,Leo Minh,999.000,499.000,600,4.8,6 phần,29 bài giảng,05 giờ 24 phút,"Bạn sẽ biết cách viết bài Website ở bất kì giao diện viết bài nào. Bạn sẽ có được tư duy viết bài Content chuẩn SEO. Bạn sẽ tự tin nhận bất cứ job Content Website của bất kì dự án nào. Bạn sẽ hiểu rõ giá trị của việc viết Content website và nâng cao mức lương khi làm Content webiste. Bạn sẽ có thể tự quản lý và phát triển Team Content Website từ a-z. Bạn sẽ có tư duy xây dựng bộ từ khóa để phát triể Website. Bạn sẽ hiểu rõ các vấn đề khi Marketing website, từ đó phối hợp chặt chẽ hơn với đội SEO. Bạn sẽ sở hữu bộ tài liệu đầy đủ đính kèm về các quy chuẩn khi viết bài chuẩn SEO từ đơn vị đã phát triển hơn 200 website.",Content Marketing
https://unica.vn/google-ads-co-ban-cho-moi-gioi-bat-dong-san,Google Ads cơ bản cho môi giới bất động sản,Đoàn Chấn Hùng,800.000,699.000,22,5.0,4 phần,47 bài giảng,11 giờ 45 phút,Bạn sẽ hiểu được hành vi của khách hàng trong việc tìm kiếm thông tin trên Internet. Bạn sẽ hiểu được cơ chế và hệ thống quảng cáo của Google. Bạn sẽ có kỹ năng lập kế hoạch và triển khai hệ thống quảng cáo tìm kiếm và hiển thị của Goolge. Bạn sẽ có được nhiều khách hàng chất lượng từ hệ thống quảng cáo của Google.,"Bất động sản, Google Ads"
https://unica.vn/facebook-marketing-can-ban-cho-moi-gioi-bat-dong-san,Facebook Marketing căn bản cho môi giới bất động sản,Đoàn Chấn Hùng,700.000,599.000,76,5.0,5 phần,45 bài giảng,11 giờ 21 phút,"Thông qua khoá training về Facebook Marketing, bạn sẽ:. Hiểu được cơ chế hoạt động hệ thống phân phối quảng cáo hiển thị của Facebook.. Bạn sẽ có kỹ năng lập kế hoạch và triển khai quảng cáo Facebook để tìm kiếm khách hàng tiềm năng.. Bạn sẽ tạo và quản lý được nhiều Fanpage phục vụ cho việc phát triển dài hạn kinh doanh của mình.","Facebook Marketing, Bất động sản"
https://unica.vn/tao-lap-va-toi-uu-landing-page-ban-hang-101,Tạo lập và tối ưu Landing Page bán hàng 101,LadiPage Việt Nam,800.000,399.000,524,4.9,4 phần,30 bài giảng,02 giờ 36 phút,"Hiểu được Landing Page là gì mà đóng vai trò không thể thiếu ở hầu hết mọi chiến dịch Marketing-Sales. Nắm được cách thức hoạt động của landing page và biết cách chọn loại landing page phù hợp với chiến dịch của mình. Ứng dụng các công thức đơn giản mà hiệu quả để từng bước xây dựng nội dung landing page từ khái quát đến chi tiết. Biết cách tạo lập nội dung đánh trúng tâm lý và hành vi của khách hàng, theo đúng chuẩn AIDA. Nắm bắt các nguyên tắc thiết kế căn bản để tạo được Landing Page hài hòa, đẹp mắt. Học cách thiết kế kéo thả và thiết lập các yếu tố gia tăng chuyển đổi của khách hàng trên trang đích với bộ công cụ của LadiPage","Marketing Online, Landingpage"
https://unica.vn/xay-dung-chien-luoc-email-marketing-a-z-bi-quyet-tang-truong-ben-vung,Chiến lược Email Marketing A-Z: Bí quyết Tăng trưởng Bền vững,Grow with Anny: Growth Marketing,900.000,299.000,61,5.0,7 phần,51 bài giảng,02 giờ 46 phút,"Tự thiết kế chiến lược Email Marketing phù hợp nhất với DN mình. Hiểu sâu sắc bản chất mọi thứ vận hành & mối liên hệ trong Email Marketing. Biết lập báo cáo hiệu quả & phân tích tác động của Email Marketing đối với DN của mình từ nhiều góc độ. Vận hành Email Marketing trơn chu hơn: quản lý chiến dịch hiệu quả, tự động hoá báo cáo. Biết cách áp dụng những công nghệ mới nhất vào Email Marketing để tạo đột phá trong hiệu quả. Làm chủ & xây dựng mối quan hệ bền vững, lâu dài với khách hàng. Có nguồn doanh thu bền vững từ kênh Email, không phụ thuộc hoàn toàn vào các kênh quảng cáo trả phí. Tự làm chủ kênh email Email Marketing, không cần thuê agency bên ngoài","Email Marketing, Marketing Online"
https://unica.vn/tu-thiet-ke-website-cho-moi-linh-vuc-ma-khong-can-biet-lap-trinh,Tự thiết kế website chuẩn SEO mà không cần biết lập trình,Hải Trần ,600.000,499.000,144,5.0,4 phần,37 bài giảng,05 giờ 40 phút,"Những lợi ích bạn nhận được sau khóa học:. Tiết kiệm chi phí thuê thiết kế và quản lý website.. Tự thay đổi linh hoạt website phù hợp với định hướng kinh doanh của mình.. Giúp gia tăng doanh số bán hàng từ website.. Có thể thiết kế các website tin tức, bán hàng đẹp mắt và chuyên nghiệp.. Tự tin mở dịch vụ thiết kế website chuyên nghiệp.","Thiết kế Web, Lập Trình Web, Công nghệ thông tin"
https://unica.vn/toi-uu-va-quang-cao-video-tren-youtube,Tối ưu và quảng cáo video trên Youtube,Hoàng Trọng Lâm,499.000,390.000,75,4.0,3 phần,32 bài giảng,04 giờ 03 phút,Hiểu rõ bộ máy về Youtube Marketing. Tối ưu chuẩn chỉnh về kênh Youtube của mình. Seo video Youtube đưa video lên Top youtube. Cách Chạy quảng cáo tiếp cận khách hàng một cách chính xác nhất. Chi phí quảng cáo chỉ vài đồng trên một lượt xem. Dùng kênh Youtube Marketing để bán sản phẩm một cách hiệu quả,"Youtube Marketing, Video marketing"
https://unica.vn/tuyet-dinh-seo-website-vua-len-top-ben-vung-va-ra-don,Tuyệt đỉnh SEO website vừa lên TOP bền vững và ra đơn,Huỳnh Ngọc Thanh,1.000.000,399.000,206,4.3,12 phần,93 bài giảng,09 giờ 04 phút,"Bạn không chỉ được học kiến thức SEO web. Mà bạn còn được học thêm kiến thức về Khóa học thiết kế website WordPress ngay trong lớp học SEO website.. Ngoài ra, trong lớp học SEO website. Bạn được đào tạo về hiệu ứng chim mồi. Thúc đẩy khách hàng phải hành động mua hàng ngay để không bị bỏ lỡ.. Huỳnh Ngọc Thanh sẽ hướng dẫn bạn bí kíp tăng tỷ lệ mua hàng. Từ người xem chuyển đổi thành khách mua hàng thực sự.. Giảng viên sẽ hướng dẫn bạn cách viết content thôi miên khiến khách hàng không thể chối từ.. Cách viết content bài viết đúng chuẩn Google để hệ thống Google phải đánh giá cao và đưa lên TOP.. Khai báo website với Google như: Google Tag Manager, Google Analytics. Google Search Console.",Seo
https://unica.vn/marketing-cho-nguoi-khong-chuyen,Marketing cho người không chuyên,Tạ Thị Trang,899.000,400.000,44,5.0,3 phần,30 bài giảng,05 giờ 18 phút,"Hình thành tư duy marketing cơ bản để có thể linh hoạt thích nghi với sự thay đổi của môi trường kinh doanh đầy biến động. Hiểu được những nền tảng cốt lõi của marketing từ việc nghiên cứu thị trường, xây dựng chiến lược, thực thi và kiểm soát. Cụ thể hóa những khái niệm và thành phần về truyền thông, thương hiệu, kênh phân phối, sản phẩm, quản trị dịch vụ, cách tiếp cận làm marketing thị trường quốc tế,.... Hỗ trợ cho việc phát triển công việc, sự nghiệp và doanh nghiệp của bạn. Hỗ trợ tư vấn, đưa ra giải pháp các vấn đề marketing mà bạn đang gặp phải. Hỗ trợ định hướng việc phát triển công việc marketing đối với các bạn làm trái ngành",Marketing Online
https://unica.vn/viet-content-thoi-mien,Viết Content thôi miên,Hán Quang Dự,1.200.000,999.000,294,4.6,4 phần,30 bài giảng,03 giờ 15 phút,Giúp học viên nắm được các tiêu chí của một content thôi miên. Cung cấp 36 chủ đề giúp bạn sáng tạo nội dung vô tận trên Facebook. Các ví dụ chi tiết cho từng chủ đề content thôi miên để người học chỉ cần mô phỏng theo. Các bố cục viết content dễ dàng đến mức ai cũng có thể thực hành ngay một cách hiệu quả,Content Marketing
https://unica.vn/bi-quyet-giup-ban-tu-xay-dung-duoc-kenh-tiktok-trieu-view-nhieu-follow,Bí quyết giúp bạn xây dựng được kênh Tiktok triệu view - nhiều follow,Nguyễn Quang Thuyên,2.999.000,1.999.000,122,4.6,6 phần,45 bài giảng,05 giờ 25 phút,"Bạn sẽ biết được các bước để tự xây dựng được - cũng như sự sống còn của 1 tài khoản triệu view. Bạn sẽ biết cách để BẺ KHÓA THUẬT TOÁN CỦA TIKTOK. Bạn sẽ nắm được các bí mật trong thuật toán cốt lõi của Tiktok. Bạn sẽ biết được sở thích, tính cách, và thứ tự ưu tiên đánh giá xếp hạng video, kênh của bản thân.. Bạn sẽ nắm được các bước, và biết rõ ràng mình phải làm gì để có 1 kênh Tiktok ưng ý.. Bạn sẽ được cung cấp tư duy đúng về việc phát triển kênh Tiktok chuyên nghiệp nhất.. Bạn sẽ được sở hữu một quy trình tự xây kênh Tiktok triệu view – nhiều follow. Bạn cũng sẽ biết cách sửa chữa, khắc phục những sự cố kênh Tiktok đang gặp phải như mất tương tác, tụt follow. Và quan trọng nhất là nó đơn giản – bạn có thể áp dụng được ngay và có kết quả","Kinh doanh Online, Kinh doanh, Marketing Online, Startup, Tiktok"
https://unica.vn/36-tuyet-chieu-toi-uu-quang-cao-facebook,36 Tuyệt Chiêu Tối Ưu Quảng Cáo Facebook Đỉnh KAO-Kinh nghiệm thực chiến đốt 2tr$,Bùi Dự,3.000.000,1.598.000,54,3.7,1 phần,36 bài giảng,06 giờ 04 phút,Hiểu được bản chất hôm nay ra đơn ngày mai lại không ra đơn?. Tại sao bán được hàng mà vẫn không thấy tiền đầu?. Công thức scale x10 lần hiệu quả mà không bị SML. Tạo ra hàng loạt tài khoản quảng cáo và bid ngân sách cao mà không ảnh hưởng đến kết quả. Các thủ thuật để chạy quảng cáo rẻ. Tối ưu lại phễu bán hàng sao cho tỷ lệ chuyển đổi cao.,Facebook Marketing
https://unica.vn/xay-dung-chien-luoc-email-marketing-a-z-bi-quyet-tang-truong-ben-vung,Chiến lược Email Marketing A-Z: Bí quyết Tăng trưởng Bền vững,Grow with Anny: Growth Marketing,900.000,299.000,61,5.0,7 phần,51 bài giảng,02 giờ 46 phút,"Tự thiết kế chiến lược Email Marketing phù hợp nhất với DN mình. Hiểu sâu sắc bản chất mọi thứ vận hành & mối liên hệ trong Email Marketing. Biết lập báo cáo hiệu quả & phân tích tác động của Email Marketing đối với DN của mình từ nhiều góc độ. Vận hành Email Marketing trơn chu hơn: quản lý chiến dịch hiệu quả, tự động hoá báo cáo. Biết cách áp dụng những công nghệ mới nhất vào Email Marketing để tạo đột phá trong hiệu quả. Làm chủ & xây dựng mối quan hệ bền vững, lâu dài với khách hàng. Có nguồn doanh thu bền vững từ kênh Email, không phụ thuộc hoàn toàn vào các kênh quảng cáo trả phí. Tự làm chủ kênh email Email Marketing, không cần thuê agency bên ngoài","Email Marketing, Marketing Online"
https://unica.vn/tu-thiet-ke-website-cho-moi-linh-vuc-ma-khong-can-biet-lap-trinh,Tự thiết kế website chuẩn SEO mà không cần biết lập trình,Hải Trần ,600.000,499.000,144,5.0,4 phần,37 bài giảng,05 giờ 40 phút,"Những lợi ích bạn nhận được sau khóa học:. Tiết kiệm chi phí thuê thiết kế và quản lý website.. Tự thay đổi linh hoạt website phù hợp với định hướng kinh doanh của mình.. Giúp gia tăng doanh số bán hàng từ website.. Có thể thiết kế các website tin tức, bán hàng đẹp mắt và chuyên nghiệp.. Tự tin mở dịch vụ thiết kế website chuyên nghiệp.","Thiết kế Web, Lập Trình Web, Công nghệ thông tin"
https://unica.vn/toi-uu-va-quang-cao-video-tren-youtube,Tối ưu và quảng cáo video trên Youtube,Hoàng Trọng Lâm,499.000,390.000,75,4.0,3 phần,32 bài giảng,04 giờ 03 phút,Hiểu rõ bộ máy về Youtube Marketing. Tối ưu chuẩn chỉnh về kênh Youtube của mình. Seo video Youtube đưa video lên Top youtube. Cách Chạy quảng cáo tiếp cận khách hàng một cách chính xác nhất. Chi phí quảng cáo chỉ vài đồng trên một lượt xem. Dùng kênh Youtube Marketing để bán sản phẩm một cách hiệu quả,"Youtube Marketing, Video marketing"
https://unica.vn/tuyet-dinh-seo-website-vua-len-top-ben-vung-va-ra-don,Tuyệt đỉnh SEO website vừa lên TOP bền vững và ra đơn,Huỳnh Ngọc Thanh,1.000.000,399.000,206,4.3,12 phần,93 bài giảng,09 giờ 04 phút,"Bạn không chỉ được học kiến thức SEO web. Mà bạn còn được học thêm kiến thức về Khóa học thiết kế website WordPress ngay trong lớp học SEO website.. Ngoài ra, trong lớp học SEO website. Bạn được đào tạo về hiệu ứng chim mồi. Thúc đẩy khách hàng phải hành động mua hàng ngay để không bị bỏ lỡ.. Huỳnh Ngọc Thanh sẽ hướng dẫn bạn bí kíp tăng tỷ lệ mua hàng. Từ người xem chuyển đổi thành khách mua hàng thực sự.. Giảng viên sẽ hướng dẫn bạn cách viết content thôi miên khiến khách hàng không thể chối từ.. Cách viết content bài viết đúng chuẩn Google để hệ thống Google phải đánh giá cao và đưa lên TOP.. Khai báo website với Google như: Google Tag Manager, Google Analytics. Google Search Console.",Seo
https://unica.vn/marketing-cho-nguoi-khong-chuyen,Marketing cho người không chuyên,Tạ Thị Trang,899.000,400.000,44,5.0,3 phần,30 bài giảng,05 giờ 18 phút,"Hình thành tư duy marketing cơ bản để có thể linh hoạt thích nghi với sự thay đổi của môi trường kinh doanh đầy biến động. Hiểu được những nền tảng cốt lõi của marketing từ việc nghiên cứu thị trường, xây dựng chiến lược, thực thi và kiểm soát. Cụ thể hóa những khái niệm và thành phần về truyền thông, thương hiệu, kênh phân phối, sản phẩm, quản trị dịch vụ, cách tiếp cận làm marketing thị trường quốc tế,.... Hỗ trợ cho việc phát triển công việc, sự nghiệp và doanh nghiệp của bạn. Hỗ trợ tư vấn, đưa ra giải pháp các vấn đề marketing mà bạn đang gặp phải. Hỗ trợ định hướng việc phát triển công việc marketing đối với các bạn làm trái ngành",Marketing Online
https://unica.vn/viet-content-thoi-mien,Viết Content thôi miên,Hán Quang Dự,1.200.000,999.000,294,4.6,4 phần,30 bài giảng,03 giờ 15 phút,Giúp học viên nắm được các tiêu chí của một content thôi miên. Cung cấp 36 chủ đề giúp bạn sáng tạo nội dung vô tận trên Facebook. Các ví dụ chi tiết cho từng chủ đề content thôi miên để người học chỉ cần mô phỏng theo. Các bố cục viết content dễ dàng đến mức ai cũng có thể thực hành ngay một cách hiệu quả,Content Marketing
https://unica.vn/bi-quyet-giup-ban-tu-xay-dung-duoc-kenh-tiktok-trieu-view-nhieu-follow,Bí quyết giúp bạn xây dựng được kênh Tiktok triệu view - nhiều follow,Nguyễn Quang Thuyên,2.999.000,1.999.000,122,4.6,6 phần,45 bài giảng,05 giờ 25 phút,"Bạn sẽ biết được các bước để tự xây dựng được - cũng như sự sống còn của 1 tài khoản triệu view. Bạn sẽ biết cách để BẺ KHÓA THUẬT TOÁN CỦA TIKTOK. Bạn sẽ nắm được các bí mật trong thuật toán cốt lõi của Tiktok. Bạn sẽ biết được sở thích, tính cách, và thứ tự ưu tiên đánh giá xếp hạng video, kênh của bản thân.. Bạn sẽ nắm được các bước, và biết rõ ràng mình phải làm gì để có 1 kênh Tiktok ưng ý.. Bạn sẽ được cung cấp tư duy đúng về việc phát triển kênh Tiktok chuyên nghiệp nhất.. Bạn sẽ được sở hữu một quy trình tự xây kênh Tiktok triệu view – nhiều follow. Bạn cũng sẽ biết cách sửa chữa, khắc phục những sự cố kênh Tiktok đang gặp phải như mất tương tác, tụt follow. Và quan trọng nhất là nó đơn giản – bạn có thể áp dụng được ngay và có kết quả","Kinh doanh Online, Kinh doanh, Marketing Online, Startup, Tiktok"
https://unica.vn/36-tuyet-chieu-toi-uu-quang-cao-facebook,36 Tuyệt Chiêu Tối Ưu Quảng Cáo Facebook Đỉnh KAO-Kinh nghiệm thực chiến đốt 2tr$,Bùi Dự,3.000.000,1.598.000,54,3.7,1 phần,36 bài giảng,06 giờ 04 phút,Hiểu được bản chất hôm nay ra đơn ngày mai lại không ra đơn?. Tại sao bán được hàng mà vẫn không thấy tiền đầu?. Công thức scale x10 lần hiệu quả mà không bị SML. Tạo ra hàng loạt tài khoản quảng cáo và bid ngân sách cao mà không ảnh hưởng đến kết quả. Các thủ thuật để chạy quảng cáo rẻ. Tối ưu lại phễu bán hàng sao cho tỷ lệ chuyển đổi cao.,Facebook Marketing
https://unica.vn/thiet-ke-website-wordpress-chuan-seo-len-top-google,Thiết kế website wordpress chuẩn SEO lên TOP Google.,Huỳnh Ngọc Thanh,990.000,499.000,210,4.4,17 phần,171 bài giảng,13 giờ 57 phút,"Tự làm được nhiều website chuyên nghiệp và được đánh giá cao bởi Google.. Sau khi đã hoàn chỉnh 1 giao diện. Bạn sẽ biết cách NHÂN BẢN giao diện đó thành 1 giao diện khác chỉ trong vòng 5 phút.. Bạn có khả năng tạo nhiều trang Landing page trên cùng 1 website. Bằng phương pháp nhân bản chỉ tốn 2 phút để có 1 Landing Page mới.. Bạn sẽ đủ kiến thức để làm dịch vụ thiết kế website cho khách hàng.. Bạn sẽ biết cách SEO website lên TOP Google ngay trong khóa học thiết kế website Wordpress.. Bạn biết cách chèn Form đăng ký, Bản đồ Google Maps, Hộp chát, các tài khoản mạng xã hội vào website.","Thiết kế Web, Seo, Lập Trình Web"
https://unica.vn/youtube-masterclass-tat-tan-tat-ban-can-biet-ve-cach-xay-dung-1-kenh-youtube-chat-luong,Youtube MasterClass - Tất tần tật bạn cần biết về cách xây dựng 1 kênh Youtube triệu views,Dang HNN,1.190.000,990.000,278,4.7,8 phần,33 bài giảng,05 giờ 30 phút,"Xây dựng kênh Youtube với phong cách của riêng bạn, có nhiều lượt xem (views) và nhiều lượt theo dõi (subscribers). Sản xuất nội dung video một cách chất lượng, bài bản. Kiếm tiền từ Youtube Ads và Kinh doanh sản phẩm dịch vụ. Tư duy xây dựng thương hiệu cho cá nhân, tổ chức doanh nghiệp của bạn",Kiếm tiền Youtube
https://unica.vn/tuyet-dinh-seo-google-maps-len-dinh-google-trong-7-ngay,Tuyệt đỉnh SEO Google Maps lên đỉnh Google trong 7 ngày,Huỳnh Ngọc Thanh,800.000,399.000,151,5.0,9 phần,38 bài giảng,02 giờ 56 phút,"Bạn biết cách đưa tất cả vị trí cửa hàng kinh doanh của công ty bạn lên Google Maps.. Ví dụ công ty bạn có chuỗi 100 quán cà phê. Bạn biết cách đưa 100 vị trí này lên Google Maps nhanh chóng.. Bạn có tài khoản vị trí Google Maps và có thêm website miễn phí do chính Google cung cấp rất chuyên nghiệp.. Bạn biết cách thêm 1 vị trí địa điểm kinh doanh lên Google nhanh chóng.. Bạn biết cách đưa hàng trăm vị trí chuỗi địa điểm kinh doanh lên Google cực kỳ nhanh và đơn giản.. Bạn học được bí quyết mỗi khi khách hàng tìm kiếm. Bạn luôn xuất hiện mà không tốn 1 xu.. Bạn biết cách tạo, xác minh hàng trăm địa điểm trên Google. Bao phủ thương hiệu của bạn trên internet.. Chi phí Marketing cho giải pháp đưa doanh nghiệp của bạn lên Google Maps và TOP Google là 0 đồng.",Seo
https://unica.vn/xay-dung-group-trieu-thanh-vien,Xây dựng group triệu thành viên - Bùng nổ nhân hiệu triệu đô,Nguyễn Hà Linh,800.000,599.000,99,4.3,6 phần,10 bài giảng,02 giờ 26 phút,"Nắm rõ các bước triển khai và quản trị group hiệu quả: Xây dựng group từ ý tưởng thành thực tế. Cách vận hành ban quản trị group, làm việc với đối tác.. Cách phát triển thành viên cho group bền vững: Bí kíp và chiến lược phát triển thành viên nhanh, bền vững và tích cực hoạt động trên group.. Xây dựng kế hoạch content chuyên nghiệp: Kế hoạch content hàng ngày, hàng tháng, theo chiến dịch để thu hút thành viên, tăng members.... Bí kíp sinh hoạt group lớn, bùng nổ nhân hiệu: Bật mí công thức viết content nghìn like, bí kíp duyệt bài sớm, trở thành Top Member, Reviewer chuyên nghiệp trên các group lớn.",Phát triển đội nhóm
