course_link,course_name,instructor,old_price,new_price,number_of_students,rating,sections,lectures,duration,what_you_learn,tags
https://unica.vn/bi-mat-seo-video-len-top-google-youtube-trong-5-gio,"Bí mật SEO video lên top Google, Youtube trong 5 giờ",Vương Kiệt Dũng,700.000,499.000,17,3.0,11 phần,42 bài giảng,03 giờ 09 phút,"Bạn sẽ biết cách SEO video Youtube chiếm hết vị trí TOP đầu trên Youtube, google trong 5 giờ.. Biết cách phát triển kênh Youtube cá nhân và kênh Youtube thương hiệu.. Hiểu và biết cách sử dụng Seo mũ đen, seo mũ trắng. Bạn được bật mí công cụ chuyên dùng để Seo của các cao thủ Youtuber trên thế giới.","Kiếm tiền Youtube, Seo, Youtube Marketing"
https://unica.vn/chay-quang-cao-facebook-chuyen-sau-cho-nguoi-moi-bat-dau,Chạy quảng cáo facebook chuyên sâu cho người mới bắt đầu,Nguyễn Thu Hằng,900.000,399.000,85,5.0,7 phần,58 bài giảng,06 giờ 24 phút,"Biết cách chạy quảng cáo Facebook một cách đúng quy trình, bài bản, cập nhật mới nhất hiện nay.. Lĩnh hội những bí kíp, kinh nghiệm hay được tích lũy trong nhiều năm từ người đi trước.. Được hướng dẫn thực hành một cách chi tiết, chuyên sâu từ căn bản đến nâng cao.. Biết cách chạy thành thạo, đa dạng các quảng cáo phổ biến nhất hiện nay như tin nhắn, tương tác, like page, quảng cáo trên Instagram.... Tiết kiệm hàng triệu đồng lãng phí nếu tự chạy mà không biết cách tối ưu hiệu quả.. Được hướng dẫn cách viết content bán hàng sao cho hấp dẫn và tăng khả năng chuyển đổi đơn hàng.. Từ đó giúp bạn gia tăng doanh thu, gia tăng lợi nhuận trong tầm tay.",Facebook Marketing
https://unica.vn/tron-bo-quang-cao-tu-a-z-tren-nen-tang-zalo-2022,Trọn bộ Quảng cáo từ A-Z trên nền tảng Zalo (2022),Lê Minh Duy,900.000,699.000,41,5.0,3 phần,13 bài giảng,02 giờ 13 phút,"Tự tin thực hiện và biết cách tối ưu để đạt kết quả tốt nhất qua các dạng quảng cáo phổ biến trên Zalo.. Nắm bắt tư duy vận hành quảng cáo và cập nhật những kiến thức chuyên môn mới nhất. Tiết kiệm ngân sách, giảm hơn 30% chi phí nhưng cam kết vẫn giữ nguyên hiệu quả.. Được tham gia Group kín hỗ trợ trực tiếp từ giảng viên cũng như sẽ có các hoạt động Livestream hỏi đáp thường xuyên.",Zalo Marketing
https://unica.vn/Xay-dung-thuong-hieu-ca-nhan-tren-internet,Xây dựng thương hiệu cá nhân trên internet,Nguyễn Ngọc Định,500.000,399.000,18,5.0,6 phần,24 bài giảng,01 giờ 46 phút,Hiểu đúng về thương hiệu cá nhân. Biết cách định vị thương hiệu cá nhân. Nắm được chiến lược xây dựng thương hiệu cá nhân. Biết cách tận dụng thương hiệu cá nhân để kiếm tiền,"Thương hiệu cá nhân, Xây dựng thương hiệu"
https://unica.vn/marketing-duoc-can-ban-zero-to-marketer,Marketing Dược căn bản: Zero to Marketer,Học viện MPG,1.200.000,929.000,8,5.0,7 phần,30 bài giảng,04 giờ 28 phút,"Hiểu tổng quan về Marketing Dược và các nấc thang nghề nghiệp.. Nắm được phương pháp, kỹ năng để làm tốt công việc của 1 nhân sự Marketing Dược.. Có khả năng nghiên cứu thị trường, tìm ra Insight khách hàng, lựa chọn nhóm khách hàng mục tiêu.. Hiểu được vai trò từng kênh truyền thông và biết cách lựa chọn kênh tối ưu nhất. Nâng cao năng lực cạnh tranh khi ứng tuyển những vị trí Marketing Dược với mức lương cao",Marketing Online
https://unica.vn/mini-game,GAMIFICATION - NGUYỄN TRỌNG THƠ,Nguyễn Trọng Thơ,1.000.000,599.000,22,,1 phần,16 bài giảng,01 giờ 40 phút,"Gắn kết giữa khách hàng và doanh nghiệp, giữa các thành viên trong doanh nghiệp. Thúc đẩy, tạo động lực mạnh mẽ kích thích mọi người cùng tương tác với nhau trong các hoạt động marketing. Gia tăng trải nghiệm khách hàng và tạo sự khác biệt cho doanh nghiệp của bạn với các đối thủ cạnh tranh. Tăng khả năng biến khách hàng tiềm năng thành khách hàng trung thành với doanh nghiêp.","Kinh doanh, Marketing Online, Tăng doanh số"
https://unica.vn/website-automation---facebook-ads,WEBSITE AUTOMATION - FACEBOOK ADS,Nguyễn Trọng Thơ,1.000.000,599.000,34,5.0,1 phần,23 bài giảng,01 giờ 52 phút,Thu hút khách hàng vào website bằng quảng cáo Facebook. Quy trình 4 bước đơn giản để vận hành Doanh nghiệp online dựa trên nền tảng Facebook,"Facebook Marketing, Marketing Online"
https://unica.vn/website-automation---google-ads,WEBSITE AUTOMATION - GOOGLE ADS,Nguyễn Trọng Thơ,1.000.000,599.000,33,,1 phần,15 bài giảng,01 giờ 26 phút,"Thu hút khách hàng vào website bằng quảng cáo Google. Bạn chỉ cần cài đặt quảng cáo 1 lần và để đó cả năm, Google rất thông minh nó sẽ tìm kiếm khách hàng cho bạn, đều đặn mỗi ngày",Google Ads
https://unica.vn/website-automation---seo-master,WEBSITE AUTOMATION - SEO MASTER,Nguyễn Trọng Thơ,1.000.000,599.000,29,,1 phần,22 bài giảng,01 giờ 54 phút,"Nẵm được bí quyết đưa Website lên Trang 1 Google. Đưa video của bạn lên trang 1 Youtube. Đưa sản phẩm của bạn lên trang 1 tìm kiếm của Shopee, Amazon. Tăng doanh số nhanh chóng","Thiết kế Web, Seo"
https://unica.vn/ladipage-nen-tang-marketing-dinh-cao,Ladipage: Nền tảng marketing đỉnh cao,Vũ Thành,1.000.000,349.000,1,,8 phần,29 bài giảng,04 giờ 08 phút,Hiểu rõ về Ladipage. Xây dựng trang Landing chuyên nghiệp. Tăng cường hiệu quả marketing. Nắm vững kiến thức về chiến lược và kỹ thuật tiếp thị online. Trở thành chuyên gia sử dụng Ladipage,Landingpage
https://unica.vn/basic-marketing-online-tu-tin-chinh-phuc-marketing-chi-sau-2h,Basic Marketing Tree Online - Khóa học Marketing Căn bản Từ Gốc đến Ngọn ,Trần Mạnh Hùng,1.000.000,599.000,4,5.0,5 phần,29 bài giảng,02 giờ 28 phút,"Tăng khả năng tư duy, suy luận về Marketing.. Quản trị phòng ban Marketing hiệu quả.. Khoá học sẽ giúp bạn hiểu rõ bản chất, gốc rễ, kiến thức nền tảng của Marketing.. Tự tin lên kế hoạch, chiến lược Marketing và thực thi một cách hiệu quả.",Marketing Online
https://unica.vn/chatgpt-marketing-mastery-tao-noi-dung-da-kenh-chua-bao-gio-de-den-the,ChatGPT Marketing Mastery: Tạo nội dung đa kênh chưa bao giờ dễ đến thế,Vương Duy Định,2.000.000,1.199.000,7,5.0,4 phần,23 bài giảng,04 giờ 48 phút,"Bạn sẽ biết cách tận dụng sức mạnh của ChatGPT để phát triển các chiến lược tiếp thị và xây dựng thương hiệu của mình. Bạn sẽ tự tin xây dựng plan, ý tưởng và tạo nội dung thu hút trên các mạng xã hội. Hiểu biết sâu sắc hơn về xử lý ngôn ngữ tự nhiên và các ứng dụng của nó trong tiếp thị. Luôn cập nhật những phát triển mới nhất trong ChatGPT và các ứng dụng của ChatGPT trong tiếp thị","Marketing Online, trí tuệ nhân tạo (AI)"
https://unica.vn/tu-tao-landing-page-giup-tang-ty-le-mua-hang,Tự tạo landing page giúp tăng tỷ lệ mua hàng,Đặng Lợi,500.000,99.000,68,5.0,4 phần,53 bài giảng,03 giờ 03 phút,Biết cách thiết kế trang đích chuyển đổi mà không cần bất kỳ kinh nghiệm lập trình nào. Biết cách viết gây sự thu hút khiến khách truy cập trang bán hàng ngay lập tức. Biết cách tạo giá trị nổi bật cho sản phẩm đang bán của bạn (có mẫu và ví dụ). Nắm được phương pháp hay nhất để xây dựng trang đích chuyển đổi cao. Bạn sẽ học được qua phân tích các ví dụ về trang đích từ nhiều ngành khác nhau. Biết sử dụng các nguyên tắc tâm lý như bằng chứng xã hội để tạo niềm tin và uy tín ngay lập tức. Cách theo dõi Quảng cáo Facebook của đối thủ cạnh tranh của bạn và khám phá các trang đích hoạt động tốt nhất của họ. Biết tạo trang đích trong vòng 15 phút,Landingpage
https://unica.vn/quang-cao-tiktok-thu-hut-khach-hang-tiem-nang-x3-doanh-so,Quảng cáo Tiktok- thu hút khách hàng tiềm năng x3 doanh số,Đặng Lợi,1.000.000,399.000,83,5.0,10 phần,93 bài giảng,06 giờ 15 phút,"Bạn biết từng bước TỰ MÌNH chạy quảng cáo Tiktok từ con số 0 (ngay cả khi bạn không rành về công nghệ). Bạn biết nhắm mục tiêu tới những người thực sự QUAN TÂM đến sản phẩm, dịch vụ (tiết kiệm thời gian, tiền của bạn). Bạn biết TỐI ƯU quảng cáo để đạt được kết quả như bạn mong muốn. Bạn biết cách quảng cáo Re-marketing TIẾP THỊ LẠI tới những người đã quan tâm đến sản phẩm, dịch vụ. Bạn biết 10 bước thiết kế trang đích TĂNG CHUYỂN ĐỔI mua hàng (các ví dụ cụ thể). CẦM TAY CHỈ VIỆC thực hành tự tạo ra các trang đích (ngay cả khi kiến thức IT bằng 0). Bạn biết làm sao để chiến dịch quảng cáo được Tiktok PHÊ DUYỆT SỚM. Bạn học được 12 TƯ DUY TIẾP THỊ (Marketing) quan trọng hơn cả việc chạy quảng cáo",Tiktok
https://unica.vn/storytelling-lieu-thuoc-tien-cho-marketing-bat-dong-san,StoryTelling -  Liều thuốc tiên cho Marketing bất động sản,Dương Tống,2.500.000,299.000,2,5.0,10 phần,38 bài giảng,03 giờ 47 phút,"Hiểu được các hình thức kể chuyện áp dụng vào marketing bất động sản. Ứng dụng storytelling vào content website, blog, social media và đặc biệt là sản xuất video. Lên được các chiến lược marketing hiệu quả, sử dụng storytelling làm trọng tâm. Tạo ra sự khác biệt cho thương hiệu doanh nghiệp mình thông qua kỹ năng storytelling đặc sắc. Tạo được sự khác biệt cho văn hoá doanh nghiệp. Hiểu và thấm nhuần tầm quan trọng của các câu chuyện (stories) và nghệ thuật kể chuyện (storytelling) đối với việc kết nối con người trong cuộc sống và trong marketing.","Bất động sản, Marketing cho Bất động sản"
https://unica.vn/xay-dung-thuong-hieu-ca-nhan-personal-branding-building,Xây dựng thương hiệu cá nhân - Personal Branding Building,Nguyễn Thùy Nguyên,700.000,499.000,3,5.0,4 phần,11 bài giảng,01 giờ 34 phút,"Hiểu rõ nguyên nhân để có một sự nghiệp thành công. Nắm được cách thức định vị giá trị bản thân, cách tạo động lực cho chính mình. Xây dựng được niềm tin và sự ảnh hưởng đến các đối tượng xung quanh. Tìm được đích đến sự nghiệp cho mình","Thương hiệu cá nhân, Xây dựng thương hiệu"
https://unica.vn/khoa-hoc-google-tag-manager,Khóa Học Google Tag Manager giúp Theo Dõi Chuyển Đổi Google Ads và Google Analytics 4,Hồ Hồng Phước,1.000.000,299.000,28,5.0,4 phần,19 bài giảng,02 giờ 56 phút,Bạn sẽ hiểu rõ thuật toán xếp hạng quảng cáo Google Ads. Bạn sẽ biết cách phân tích hành vi khách hàng theo từng ngành nghề. Bạn sẽ tự tay đưa quảng cáo lên mạng hiển thị ngay trong học. Bạn sẽ tự mình thiết lập các chiến dịch Quảng cáo hiển thị. Bạn sẽ được những sai lầm thường gặp trong quảng cáo và cách khắc phục. Bạn sẽ biết cách đo lường chuyển đổi và tối ưu theo đúng “lộ trình chuyển đổi”,Google Ads
https://unica.vn/khoa-hoc-google-ads-hien-thi,Khóa Học Google Ads Hiển Thị giúp Xây Dựng Thương Hiệu,Hồ Hồng Phước,1.000.000,299.000,77,5.0,6 phần,52 bài giảng,06 giờ 43 phút,Bạn sẽ hiểu rõ thuật toán xếp hạng quảng cáo Google Ads. Bạn sẽ biết cách phân tích hành vi khách hàng theo từng ngành nghề. Bạn sẽ tự tay đưa quảng cáo lên mạng hiển Thị ngay trong học. Bạn sẽ tự mình thiết lập các chiến dịch Quảng cáo hiển thị. Bạn sẽ được những sai lầm thường gặp trong quảng cáo và cách khắc phục. Bạn sẽ biết cách đo lường chuyển đổi và tối ưu theo đúng “lộ trình chuyển đổi”,Google Ads
https://unica.vn/khoa-hoc-google-shopping,Khóa học Google Ads Shopping giúp Bùng Nổ Doanh Số,Hồ Hồng Phước,1.000.000,299.000,79,5.0,5 phần,33 bài giảng,05 giờ 51 phút,Bạn sẽ hiểu rõ thuật toán xếp hạng quảng cáo Google Ads. Bạn sẽ biết cách phân tích hành vi khách hàng theo từng ngành nghề. Bạn sẽ tự tay đưa quảng cáo lên Top Google ngay trong khi học. Bạn sẽ tự mình thiết lập các chiến dịch Quảng cáo shopping. Bạn sẽ được những sai lầm thường gặp trong quảng cáo và cách khắc phục. Bạn sẽ biết cách đo lường chuyển đổi và tối ưu theo đúng “lộ trình chuyển đổi”,Google Ads
https://unica.vn/khoa-hoc-google-ads-tim-kiem,Khóa Học Google Ads Tìm Kiếm giúp Tăng Doanh Thu,Hồ Hồng Phước,1.000.000,299.000,93,5.0,5 phần,33 bài giảng,05 giờ 19 phút,Bạn sẽ hiểu rõ thuật toán xếp hạng quảng cáo Google Ads. Bạn sẽ biết cách phân tích hành vi khách hàng theo từng ngành nghề. Bạn sẽ tự tay đưa quảng cáo lên Top Google ngay trong học. Bạn sẽ tự mình thiết lập các chiến dịch Quảng cáo tìm kiếm. Bạn sẽ được những sai lầm thường gặp trong quảng cáo và cách khắc phục. Bạn sẽ biết cách đo lường chuyển đổi và tối ưu theo đúng “lộ trình chuyển đổi”,Google Ads
https://unica.vn/khoa-hoc-kiem-tien-voi-affiliate-marketing-tiep-thi-lien-ket-kiem-1000-usd-thang,Khóa Học Kiếm Tiền Với Affiliate Marketing Tiếp Thị Liên Kết Kiếm 1.000 Usd/ Tháng,Nguyễn Văn Thế,8.000.000,3.999.000,14,5.0,2 phần,28 bài giảng,06 giờ 50 phút,Nắm vững 100% kiến thức ngành Affiliate Marketing. Bạn sẽ tự tin triển khai mọi chiến dịch Marketing. Bạn sẽ thành thạo cách chọn một thị trường ngách. Bạn sẽ biết cách chọn sản phẩm hoặc dịch vụ kinh doanh phù hợp,Affiliate Marketing
https://unica.vn/tu-tao-landing-page-giup-tang-ty-le-mua-hang,Tự tạo landing page giúp tăng tỷ lệ mua hàng,Đặng Lợi,500.000,99.000,68,5.0,4 phần,53 bài giảng,03 giờ 03 phút,Biết cách thiết kế trang đích chuyển đổi mà không cần bất kỳ kinh nghiệm lập trình nào. Biết cách viết gây sự thu hút khiến khách truy cập trang bán hàng ngay lập tức. Biết cách tạo giá trị nổi bật cho sản phẩm đang bán của bạn (có mẫu và ví dụ). Nắm được phương pháp hay nhất để xây dựng trang đích chuyển đổi cao. Bạn sẽ học được qua phân tích các ví dụ về trang đích từ nhiều ngành khác nhau. Biết sử dụng các nguyên tắc tâm lý như bằng chứng xã hội để tạo niềm tin và uy tín ngay lập tức. Cách theo dõi Quảng cáo Facebook của đối thủ cạnh tranh của bạn và khám phá các trang đích hoạt động tốt nhất của họ. Biết tạo trang đích trong vòng 15 phút,Landingpage
https://unica.vn/quang-cao-tiktok-thu-hut-khach-hang-tiem-nang-x3-doanh-so,Quảng cáo Tiktok- thu hút khách hàng tiềm năng x3 doanh số,Đặng Lợi,1.000.000,399.000,83,5.0,10 phần,93 bài giảng,06 giờ 15 phút,"Bạn biết từng bước TỰ MÌNH chạy quảng cáo Tiktok từ con số 0 (ngay cả khi bạn không rành về công nghệ). Bạn biết nhắm mục tiêu tới những người thực sự QUAN TÂM đến sản phẩm, dịch vụ (tiết kiệm thời gian, tiền của bạn). Bạn biết TỐI ƯU quảng cáo để đạt được kết quả như bạn mong muốn. Bạn biết cách quảng cáo Re-marketing TIẾP THỊ LẠI tới những người đã quan tâm đến sản phẩm, dịch vụ. Bạn biết 10 bước thiết kế trang đích TĂNG CHUYỂN ĐỔI mua hàng (các ví dụ cụ thể). CẦM TAY CHỈ VIỆC thực hành tự tạo ra các trang đích (ngay cả khi kiến thức IT bằng 0). Bạn biết làm sao để chiến dịch quảng cáo được Tiktok PHÊ DUYỆT SỚM. Bạn học được 12 TƯ DUY TIẾP THỊ (Marketing) quan trọng hơn cả việc chạy quảng cáo",Tiktok
https://unica.vn/storytelling-lieu-thuoc-tien-cho-marketing-bat-dong-san,StoryTelling -  Liều thuốc tiên cho Marketing bất động sản,Dương Tống,2.500.000,299.000,2,5.0,10 phần,38 bài giảng,03 giờ 47 phút,"Hiểu được các hình thức kể chuyện áp dụng vào marketing bất động sản. Ứng dụng storytelling vào content website, blog, social media và đặc biệt là sản xuất video. Lên được các chiến lược marketing hiệu quả, sử dụng storytelling làm trọng tâm. Tạo ra sự khác biệt cho thương hiệu doanh nghiệp mình thông qua kỹ năng storytelling đặc sắc. Tạo được sự khác biệt cho văn hoá doanh nghiệp. Hiểu và thấm nhuần tầm quan trọng của các câu chuyện (stories) và nghệ thuật kể chuyện (storytelling) đối với việc kết nối con người trong cuộc sống và trong marketing.","Bất động sản, Marketing cho Bất động sản"
https://unica.vn/xay-dung-thuong-hieu-ca-nhan-personal-branding-building,Xây dựng thương hiệu cá nhân - Personal Branding Building,Nguyễn Thùy Nguyên,700.000,499.000,3,5.0,4 phần,11 bài giảng,01 giờ 34 phút,"Hiểu rõ nguyên nhân để có một sự nghiệp thành công. Nắm được cách thức định vị giá trị bản thân, cách tạo động lực cho chính mình. Xây dựng được niềm tin và sự ảnh hưởng đến các đối tượng xung quanh. Tìm được đích đến sự nghiệp cho mình","Thương hiệu cá nhân, Xây dựng thương hiệu"
https://unica.vn/khoa-hoc-google-tag-manager,Khóa Học Google Tag Manager giúp Theo Dõi Chuyển Đổi Google Ads và Google Analytics 4,Hồ Hồng Phước,1.000.000,299.000,28,5.0,4 phần,19 bài giảng,02 giờ 56 phút,Bạn sẽ hiểu rõ thuật toán xếp hạng quảng cáo Google Ads. Bạn sẽ biết cách phân tích hành vi khách hàng theo từng ngành nghề. Bạn sẽ tự tay đưa quảng cáo lên mạng hiển thị ngay trong học. Bạn sẽ tự mình thiết lập các chiến dịch Quảng cáo hiển thị. Bạn sẽ được những sai lầm thường gặp trong quảng cáo và cách khắc phục. Bạn sẽ biết cách đo lường chuyển đổi và tối ưu theo đúng “lộ trình chuyển đổi”,Google Ads
https://unica.vn/khoa-hoc-google-ads-hien-thi,Khóa Học Google Ads Hiển Thị giúp Xây Dựng Thương Hiệu,Hồ Hồng Phước,1.000.000,299.000,77,5.0,6 phần,52 bài giảng,06 giờ 43 phút,Bạn sẽ hiểu rõ thuật toán xếp hạng quảng cáo Google Ads. Bạn sẽ biết cách phân tích hành vi khách hàng theo từng ngành nghề. Bạn sẽ tự tay đưa quảng cáo lên mạng hiển Thị ngay trong học. Bạn sẽ tự mình thiết lập các chiến dịch Quảng cáo hiển thị. Bạn sẽ được những sai lầm thường gặp trong quảng cáo và cách khắc phục. Bạn sẽ biết cách đo lường chuyển đổi và tối ưu theo đúng “lộ trình chuyển đổi”,Google Ads
https://unica.vn/khoa-hoc-google-shopping,Khóa học Google Ads Shopping giúp Bùng Nổ Doanh Số,Hồ Hồng Phước,1.000.000,299.000,79,5.0,5 phần,33 bài giảng,05 giờ 51 phút,Bạn sẽ hiểu rõ thuật toán xếp hạng quảng cáo Google Ads. Bạn sẽ biết cách phân tích hành vi khách hàng theo từng ngành nghề. Bạn sẽ tự tay đưa quảng cáo lên Top Google ngay trong khi học. Bạn sẽ tự mình thiết lập các chiến dịch Quảng cáo shopping. Bạn sẽ được những sai lầm thường gặp trong quảng cáo và cách khắc phục. Bạn sẽ biết cách đo lường chuyển đổi và tối ưu theo đúng “lộ trình chuyển đổi”,Google Ads
https://unica.vn/khoa-hoc-google-ads-tim-kiem,Khóa Học Google Ads Tìm Kiếm giúp Tăng Doanh Thu,Hồ Hồng Phước,1.000.000,299.000,93,5.0,5 phần,33 bài giảng,05 giờ 19 phút,Bạn sẽ hiểu rõ thuật toán xếp hạng quảng cáo Google Ads. Bạn sẽ biết cách phân tích hành vi khách hàng theo từng ngành nghề. Bạn sẽ tự tay đưa quảng cáo lên Top Google ngay trong học. Bạn sẽ tự mình thiết lập các chiến dịch Quảng cáo tìm kiếm. Bạn sẽ được những sai lầm thường gặp trong quảng cáo và cách khắc phục. Bạn sẽ biết cách đo lường chuyển đổi và tối ưu theo đúng “lộ trình chuyển đổi”,Google Ads
https://unica.vn/khoa-hoc-kiem-tien-voi-affiliate-marketing-tiep-thi-lien-ket-kiem-1000-usd-thang,Khóa Học Kiếm Tiền Với Affiliate Marketing Tiếp Thị Liên Kết Kiếm 1.000 Usd/ Tháng,Nguyễn Văn Thế,8.000.000,3.999.000,14,5.0,2 phần,28 bài giảng,06 giờ 50 phút,Nắm vững 100% kiến thức ngành Affiliate Marketing. Bạn sẽ tự tin triển khai mọi chiến dịch Marketing. Bạn sẽ thành thạo cách chọn một thị trường ngách. Bạn sẽ biết cách chọn sản phẩm hoặc dịch vụ kinh doanh phù hợp,Affiliate Marketing
https://unica.vn/quay-dung-edit-video-chuyen-sau-bang-dien-thoai,Quay Dựng Edit Video Chuyên Sâu Bằng Điện Thoại,Nguyễn Phi Long,1.499.000,599.000,10,5.0,4 phần,22 bài giảng,02 giờ 02 phút,"Bạn sẽ biết cách canh gốc máy tạo ra những video vlog, review đơn giản nhất. Bạn sẽ biết edit chỉnh sửa màu sắc, phông chữ, tốc độ, cắt ghép, lồng nhạc..v..v..cho video... Bạn được học bí mật đằng sau những video triệu view, bí quyết giúp video dễ dàng lên xu hướng. Bạn được học trực tiếp qua zoom 2 buổi cùng chuyên gia, được học lại 6 tháng, hỗ trợ kiểm tra tối ưu video.","Nhiếp ảnh, dựng phim, Video marketing, Biên tập video"
https://unica.vn/tich-xanh-facebook,Tích Xanh Facebook,Đỗ Mạnh Dũng,500.000,0,226,4.0,2 phần,17 bài giảng,01 giờ 23 phút,Hiểu rõ về quy trình xác thực tích xanh trên Facebook và làm thế nào để áp dụng cho tài khoản của bạn.. Xây dựng một hồ sơ Facebook chính xác và đáng tin cậy để tăng cường uy tín cá nhân hoặc doanh nghiệp.. Mở rộng sự ảnh hưởng và tiếp cận của bạn trên mạng xã hội thông qua việc tăng cường tính xác thực và uy tín.. Bạn có thể tạo ra cơ hội mới trong sự nghiệp và kinh doanh của mình thông qua việc tạo lòng tin và thu hút khách hàng.,Facebook Marketing
https://unica.vn/livestream-phat-truc-tiep-voi-phan-mem-obs-studio,Livestream Phát Trực Tiếp Với Phần Mềm OBS Studio,Đỗ Mạnh Dũng,500.000,0,158,4.2,2 phần,9 bài giảng,00 giờ 37 phút,Học cách cài đặt OBS Studio một cách nhanh chóng và dễ dàng trên máy tính của bạn.. Tùy chỉnh cài đặt để đảm bảo chất lượng video và âm thanh tốt nhất cho livestream của bạn.. Tận dụng các tính năng mạnh mẽ của OBS Studio để tạo ra các buổi phát sóng độc đáo và thu hút. Hoàn toàn phù hợp cho cả người mới bắt đầu và những người có kinh nghiệm,Bán hàng livestream
https://unica.vn/tron-bo-quang-cao-facebook-a-z-tu-co-ban-den-nang-cao-2024,Trọn bộ quảng cáo Facebook A-Z từ Cơ bản đến Nâng cao (2024),Lê Minh Duy,399.000,299.000,14,5.0,7 phần,35 bài giảng,04 giờ 46 phút,"Tự tin thực hiện và biết cách tối ưu để đạt kết quả tốt nhất qua các dạng quảng cáo phổ biến trên nền tảng Facebook.. Biết cách làm nội dung để truyền thông trên nền tảng Facebook bao gồm: viết Content, làm hình ảnh và Video truyền thông. Hiểu về các chỉ số quan trọng của nền tảng Facebook để đo lường và tối ưu hiệu quả. Kiến thức từ  kinh nghiệm triển khai Facebook trong các ngành phổ biến hiện nay.","Facebook Marketing, Quảng cáo"
