course_link,course_name,instructor,old_price,new_price,number_of_students,rating,sections,lectures,duration,what_you_learn,tags
https://unica.vn/lam-chu-he-thong-marketing-thong-minh,Làm chủ hệ thống MARKETING thông minh,Nguyễn Tài Tuệ,700.000,299.000,169,4.6,6 phần,32 bài giảng,03 giờ 40 phút,"Làm chủ kiến thức nền về Marketing liên kết. Định hướng kinh doanh nhờ nắm bắt công thức phát triển kinh doanh. Biết cách lựa chọn các nguồn dẫn traffic hiệu quả để tăng doanh thu và lợi nhuận. Tránh được những sai lầm về Marketing truyền thống để tăng lợi nhuận. Được tham gia vào mạng lưới marketing liên kết toàn cầu để kiếm tiền và phát triển kinh doanh. Biết cách lựa chọn các công cụ chính xác, hiệu quả, giảm chi phí Marketing và tối đa hóa được lợi nhuận","Marketing Online, Hệ thống kinh doanh"
https://unica.vn/ban-hang-dinh-cao-voi-affiliate,Bán hàng đỉnh cao với Affiliate,Văn Thượng Hỉ,2.000.000,299.000,955,4.7,8 phần,99 bài giảng,06 giờ 29 phút,Tạo ra một trang bán hàng để không mất thời gian chốt sales nữa. Tạo ra phễu bán hàng để tăng tỷ lệ chốt sales và hoàn toàn thụ động. Tạo ra hệ thống đào tạo để hàng ngàn người bán sản phẩm cho bạn. Tạo ra những công cụ bán hàng để tiết kiệm thời gian hơn. Nguồn thu nhập thụ động vững mạnh. Xây dựng thương hiệu của bạn trên internet,"Bán hàng Online, Kinh doanh Online, Affiliate Marketing"
https://unica.vn/youtube-marketing,Youtube Marketing,Nguyễn Quốc Anh,600.000,249.000,377,4.5,6 phần,33 bài giảng,05 giờ 19 phút,"Cách làm video nhanh chóng - hiệu quả.. Xây dựng kênh Youtube riêng có nhiều subcribes.. Tối ưu kênh YouTube phát triển với ít chi phí nhất, đem lại giá trị cao.. Tự tin với ý tưởng làm clip cũng như vấn đề bản quyền, nguyên tắc cộng đồng.",Youtube Marketing
https://unica.vn/Vu-khi-ngon-tu-ung-dung-trong-pr-quang-cao-ban-hang-giao-tiep-thuyet-trinh,"Vũ khí ngôn từ: ứng dụng trong PR, Quảng cáo, Bán hàng, Giao tiếp, Thuyết trình",Huỳnh Minh Thuận,600.000,299.000,2768,4.6,9 phần,49 bài giảng,04 giờ 00 phút,Dễ dàng thực hiện được cuộc hẹn.. Tự tin nói lên ý kiến của mình trước đám đông.. Bí quyết tiếp xúc với người lạ vô cùng tự tin.. Viết quảng cáo thần sầu.. Biến một người dở thành một người giỏi.. Kỹ thuật viết giúp một người lên tầng cao mới.,"Bán hàng Online, Kinh doanh Online, Content Marketing"
https://unica.vn/marketing-bao,"Marketing Bão - Tạo lốc đơn hàng, Nâng cao doanh số", Nguyễn Quang Ngọc ,900.000,599.000,902,4.8,6 phần,22 bài giảng,02 giờ 07 phút,"Công thức bí mật để của chiến lược Marketing bão.. Giảm chi phí và tăng doanh thu khi làm theo đúng trình tự của công thức. Tăng lượng khách hàng mới, giữ chân được khách hàng cũ. Nhân rộng hơn nữa thương hiệu của mình đế với hàng ngàn khách hàng","Marketing Online, Chiến lược Marketing"
https://unica.vn/ky-thuat-viet-pr-quang-cao-ban-hang-dung-tam-ly-khach-hang,Kỹ thuật viết PR - Quảng cáo - Bán hàng đúng tâm lý khách hàng,Thiên Trần,800.000,299.000,1999,4.4,5 phần,28 bài giảng,01 giờ 59 phút,Viết hàng loạt những tiêu đề hiệu quả và thu hút đúng nhóm đối tượng khách hàng mục tiêu chỉ trong 30 giây. Sở hữu tư duy của một copywriter nhiều năm kinh nghiệm chinh chiến đủ mọi ngành nghề. Tự tin viết bất kỳ sản phẩm/dịch vụ nàođang kinh doanh vì những phương thức thực tế trong khoá học. Mở đầu các bài viết kích thích khách hàng chịu dành thời gian để đọc bài quảng cáo của bạn. Trình bày từ A - Z toàn bộ bài viết lôi cuốn khách hàng đọc hết bài của bạn một cách tự nhiên nhất. Nâng cao khả năng viết content thu hút để đạt các vị trí cao: Trưởng nhóm/ Trưởng phòng Nội dung,Content Marketing
https://unica.vn/hoc-lam-web-sieu-toc,Hướng dẫn làm web Landing Page bán hàng đỉnh cao dành cho người không chuyên,Trương Văn Hòa,600.000,249.000,531,4.3,4 phần,22 bài giảng,03 giờ 56 phút,"Khóa học hướng dẫn bạn một cách chi tiết cách thiết kế Website trong tích tắc.. Kết thúc khóa học bạn sẽ có nhiều mẹo thu hút khách hàng truy cập vào website của mình.. Biết cách xây dựng nội dung bán hàng hiệu quả và thông minh.. Tối ưu hóa Website để đưa từ khóa lên Top 1 Google với chi phí thấp có thể.. Tùy chỉnh giao diện Website theo ý muốn, thêm bớt tính năng chỉ với một cú bấm chuột.","Thiết kế Web, Landingpage"
https://unica.vn/bi-quyet-tang-doanh-so-bang-email-marketing,Bí quyết tăng doanh số bằng Email Marketing,Phạm Huy Long,600.000,299.000,128,4.9,4 phần,22 bài giảng,02 giờ 09 phút,Hiểu thế nào là Email Marketing và vị trí của nó trong chiến lược Marketing Online tổng thể. Hướng dẫn chiến lược gửi Email Marketing đúng cách. Học cách sử dụng công cụ Email Marketing hàng đầu hiện nay đó là Mailchimp. Áp dụng Email Marketing vào hoạt động kinh doanh của bạn một cách hiệu quả,Email Marketing
https://unica.vn/facebook-marketing-tu-a-z,Facebook Marketing từ A - Z,Hồ Ngọc Cương,1.000.000,699.000,14992,4.3,9 phần,74 bài giảng,07 giờ 07 phút,"Hiểu rõ bản chất và nguyên tắc chạy quảng cáo thông qua khóa học facebook ads.. Nắm chắc các công cụ hỗ trợ quảng cáo Facebook .. Tự chạy Facebook Ads thành thạo ngay sau khóa học.. Xây dựng kế hoạch chạy quảng cáo Facebook Ads hiệu quả .. Biết cách sáng tạo và xây dựng nội dung content, hình ảnh chất lượng có tính tương tác cao trong quảng cáo Facebook.. Nắm trọn các thủ thuật tối ưu quảng cáo nâng cao với chi phí thấp - lợi nhuận cao","Facebook Marketing, Marketing Online"
https://unica.vn/nghe-thuat-viet-ebook-danh-cho-nguoi-moi-bat-dau,Nghệ thuật viết Ebook dành cho người mới bắt đầu,Hán Quang Dự,1.200.000,299.000,994,4.7,7 phần,26 bài giảng,02 giờ 24 phút,"Kỹ thuật viết và thiết kế hoàn chỉnh 1 ebook với nội dung thu hút và hình thức độc đáo. Sở hữu vũ khí thiết website đơn giản nhất, không cần biết về lập trình cũng tự tay làm được. Học cách viết nội dung thôi miên, bán hàng đơn giản. Tự viết ebook, sách, bài Pr hiệu quả và thu hút",Nghệ thuật viết Ebook
https://unica.vn/kiem-tien-dinh-cao-voi-facebook-email-marketing-va-affiliate-2-0,Kiếm tiền đỉnh cao với Facebook cá nhân - Email marketing và Affiliate 2.0,Ngô Trọng Trung ,1.000.000,299.000,329,4.7,8 phần,44 bài giảng,06 giờ 10 phút,"Nắm bắt dễ dàng những kỹ năng làm chủ hệ thống kinh doanh trên Internet. Tạo ra một hệ thống kinh doanh tạo thu nhập thụ động bền vững. Thương hiệu cá nhân cũng đồng thời đươc tạo dựng cùng với hệ thống kinh doanh của bạn. Biến thời gian lướt facebook, gửi email của mình trở thành công việc kinh doanh một cách chuyên nghiệp",Email Marketing
course_link,course_name,instructor,old_price,new_price,number_of_students,rating,sections,lectures,duration,what_you_learn,tags
https://unica.vn/lam-chu-he-thong-marketing-thong-minh,Làm chủ hệ thống MARKETING thông minh,Nguyễn Tài Tuệ,700.000,299.000,169,4.6,6 phần,32 bài giảng,03 giờ 40 phút,"Làm chủ kiến thức nền về Marketing liên kết. Định hướng kinh doanh nhờ nắm bắt công thức phát triển kinh doanh. Biết cách lựa chọn các nguồn dẫn traffic hiệu quả để tăng doanh thu và lợi nhuận. Tránh được những sai lầm về Marketing truyền thống để tăng lợi nhuận. Được tham gia vào mạng lưới marketing liên kết toàn cầu để kiếm tiền và phát triển kinh doanh. Biết cách lựa chọn các công cụ chính xác, hiệu quả, giảm chi phí Marketing và tối đa hóa được lợi nhuận","Marketing Online, Hệ thống kinh doanh"
https://unica.vn/ban-hang-dinh-cao-voi-affiliate,Bán hàng đỉnh cao với Affiliate,Văn Thượng Hỉ,2.000.000,299.000,955,4.7,8 phần,99 bài giảng,06 giờ 29 phút,Tạo ra một trang bán hàng để không mất thời gian chốt sales nữa. Tạo ra phễu bán hàng để tăng tỷ lệ chốt sales và hoàn toàn thụ động. Tạo ra hệ thống đào tạo để hàng ngàn người bán sản phẩm cho bạn. Tạo ra những công cụ bán hàng để tiết kiệm thời gian hơn. Nguồn thu nhập thụ động vững mạnh. Xây dựng thương hiệu của bạn trên internet,"Bán hàng Online, Kinh doanh Online, Affiliate Marketing"
https://unica.vn/youtube-marketing,Youtube Marketing,Nguyễn Quốc Anh,600.000,249.000,377,4.5,6 phần,33 bài giảng,05 giờ 19 phút,"Cách làm video nhanh chóng - hiệu quả.. Xây dựng kênh Youtube riêng có nhiều subcribes.. Tối ưu kênh YouTube phát triển với ít chi phí nhất, đem lại giá trị cao.. Tự tin với ý tưởng làm clip cũng như vấn đề bản quyền, nguyên tắc cộng đồng.",Youtube Marketing
https://unica.vn/Vu-khi-ngon-tu-ung-dung-trong-pr-quang-cao-ban-hang-giao-tiep-thuyet-trinh,"Vũ khí ngôn từ: ứng dụng trong PR, Quảng cáo, Bán hàng, Giao tiếp, Thuyết trình",Huỳnh Minh Thuận,600.000,299.000,2768,4.6,9 phần,49 bài giảng,04 giờ 00 phút,Dễ dàng thực hiện được cuộc hẹn.. Tự tin nói lên ý kiến của mình trước đám đông.. Bí quyết tiếp xúc với người lạ vô cùng tự tin.. Viết quảng cáo thần sầu.. Biến một người dở thành một người giỏi.. Kỹ thuật viết giúp một người lên tầng cao mới.,"Bán hàng Online, Kinh doanh Online, Content Marketing"
https://unica.vn/marketing-bao,"Marketing Bão - Tạo lốc đơn hàng, Nâng cao doanh số", Nguyễn Quang Ngọc ,900.000,599.000,902,4.8,6 phần,22 bài giảng,02 giờ 07 phút,"Công thức bí mật để của chiến lược Marketing bão.. Giảm chi phí và tăng doanh thu khi làm theo đúng trình tự của công thức. Tăng lượng khách hàng mới, giữ chân được khách hàng cũ. Nhân rộng hơn nữa thương hiệu của mình đế với hàng ngàn khách hàng","Marketing Online, Chiến lược Marketing"
https://unica.vn/ky-thuat-viet-pr-quang-cao-ban-hang-dung-tam-ly-khach-hang,Kỹ thuật viết PR - Quảng cáo - Bán hàng đúng tâm lý khách hàng,Thiên Trần,800.000,299.000,1999,4.4,5 phần,28 bài giảng,01 giờ 59 phút,Viết hàng loạt những tiêu đề hiệu quả và thu hút đúng nhóm đối tượng khách hàng mục tiêu chỉ trong 30 giây. Sở hữu tư duy của một copywriter nhiều năm kinh nghiệm chinh chiến đủ mọi ngành nghề. Tự tin viết bất kỳ sản phẩm/dịch vụ nàođang kinh doanh vì những phương thức thực tế trong khoá học. Mở đầu các bài viết kích thích khách hàng chịu dành thời gian để đọc bài quảng cáo của bạn. Trình bày từ A - Z toàn bộ bài viết lôi cuốn khách hàng đọc hết bài của bạn một cách tự nhiên nhất. Nâng cao khả năng viết content thu hút để đạt các vị trí cao: Trưởng nhóm/ Trưởng phòng Nội dung,Content Marketing
https://unica.vn/hoc-lam-web-sieu-toc,Hướng dẫn làm web Landing Page bán hàng đỉnh cao dành cho người không chuyên,Trương Văn Hòa,600.000,249.000,531,4.3,4 phần,22 bài giảng,03 giờ 56 phút,"Khóa học hướng dẫn bạn một cách chi tiết cách thiết kế Website trong tích tắc.. Kết thúc khóa học bạn sẽ có nhiều mẹo thu hút khách hàng truy cập vào website của mình.. Biết cách xây dựng nội dung bán hàng hiệu quả và thông minh.. Tối ưu hóa Website để đưa từ khóa lên Top 1 Google với chi phí thấp có thể.. Tùy chỉnh giao diện Website theo ý muốn, thêm bớt tính năng chỉ với một cú bấm chuột.","Thiết kế Web, Landingpage"
https://unica.vn/bi-quyet-tang-doanh-so-bang-email-marketing,Bí quyết tăng doanh số bằng Email Marketing,Phạm Huy Long,600.000,299.000,128,4.9,4 phần,22 bài giảng,02 giờ 09 phút,Hiểu thế nào là Email Marketing và vị trí của nó trong chiến lược Marketing Online tổng thể. Hướng dẫn chiến lược gửi Email Marketing đúng cách. Học cách sử dụng công cụ Email Marketing hàng đầu hiện nay đó là Mailchimp. Áp dụng Email Marketing vào hoạt động kinh doanh của bạn một cách hiệu quả,Email Marketing
https://unica.vn/facebook-marketing-tu-a-z,Facebook Marketing từ A - Z,Hồ Ngọc Cương,1.000.000,699.000,14992,4.3,9 phần,74 bài giảng,07 giờ 07 phút,"Hiểu rõ bản chất và nguyên tắc chạy quảng cáo thông qua khóa học facebook ads.. Nắm chắc các công cụ hỗ trợ quảng cáo Facebook .. Tự chạy Facebook Ads thành thạo ngay sau khóa học.. Xây dựng kế hoạch chạy quảng cáo Facebook Ads hiệu quả .. Biết cách sáng tạo và xây dựng nội dung content, hình ảnh chất lượng có tính tương tác cao trong quảng cáo Facebook.. Nắm trọn các thủ thuật tối ưu quảng cáo nâng cao với chi phí thấp - lợi nhuận cao","Facebook Marketing, Marketing Online"
https://unica.vn/nghe-thuat-viet-ebook-danh-cho-nguoi-moi-bat-dau,Nghệ thuật viết Ebook dành cho người mới bắt đầu,Hán Quang Dự,1.200.000,299.000,994,4.7,7 phần,26 bài giảng,02 giờ 24 phút,"Kỹ thuật viết và thiết kế hoàn chỉnh 1 ebook với nội dung thu hút và hình thức độc đáo. Sở hữu vũ khí thiết website đơn giản nhất, không cần biết về lập trình cũng tự tay làm được. Học cách viết nội dung thôi miên, bán hàng đơn giản. Tự viết ebook, sách, bài Pr hiệu quả và thu hút",Nghệ thuật viết Ebook
https://unica.vn/kiem-tien-dinh-cao-voi-facebook-email-marketing-va-affiliate-2-0,Kiếm tiền đỉnh cao với Facebook cá nhân - Email marketing và Affiliate 2.0,Ngô Trọng Trung ,1.000.000,299.000,329,4.7,8 phần,44 bài giảng,06 giờ 10 phút,"Nắm bắt dễ dàng những kỹ năng làm chủ hệ thống kinh doanh trên Internet. Tạo ra một hệ thống kinh doanh tạo thu nhập thụ động bền vững. Thương hiệu cá nhân cũng đồng thời đươc tạo dựng cùng với hệ thống kinh doanh của bạn. Biến thời gian lướt facebook, gửi email của mình trở thành công việc kinh doanh một cách chuyên nghiệp",Email Marketing
https://unica.vn/hoc-lam-video-marketing-cho-nguoi-moi-bat-dau,Học làm Video Marketing cho người mới bắt đầu,Văn Thượng Hỉ,700.000,299.000,400,4.2,6 phần,55 bài giảng,03 giờ 24 phút,Sau khi học xong khóa học bạn sẽ:. Tạo ra hàng trăm video giá trị cho khách hàng. Bạn sẽ không bao giờ sợ quay video thêm một lần nào nữa. Bạn sẽ sáng tạo ra những ý tưởng quay video. Bạn sẽ nắm vững kỹ năng Body language trong video. Bạn sẽ sở hữu kỹ năng thuyết trình chuyên nghiệp,"Marketing Online, Video marketing"
https://unica.vn/40-tuyet-chieu-khuyen-mai-tang-qua-va-giam-gia,"40 Tuyệt chiêu khuyến mại, tặng quà và giảm giá",Tuấn Hà,800.000,299.000,514,4.9,1 phần,40 bài giảng,01 giờ 51 phút,"Những chiêu thức nâng cao về Tặng quà, giảm giá, khuyến mại. Thu hút khách hàng tiềm năng nhanh chóng. Giữ chân khách hàng khiến họ luôn trung thành với sản phẩm. Nhanh chóng tăng doanh thu, mang lại ảnh hưởng tích cực",Chiến lược bán hàng
https://unica.vn/ban-hang-bang-video-marketing-va-livestream,Bán hàng bằng video marketing và livestream,Văn Thượng Hỉ,800.000,299.000,490,4.3,5 phần,39 bài giảng,02 giờ 24 phút,Tự tạo cho mình hàng trăm video bán hàng. Livestream với hàng trăm nghìn lượt xem. Xây dựng được thương hiệu cá nhân facebook. Nắm vững kỹ năng body language trong video. Số lượng khách hàng đông đảo trên internet. Doanh thu cao mà không mất chi phí quảng cáo,"Video marketing, Bán hàng livestream"
https://unica.vn/32-tuyet-chieu-khuyen-mai-qua-tang-va-giam-gia,"32 Tuyệt chiêu khuyến mại, quà tặng và giảm giá",Tuấn Hà,800.000,299.000,334,4.6,1 phần,34 bài giảng,02 giờ 03 phút,Nhận ra những chiêu thức khuyến mại thu hút khách hàng không quá khó khăn. 32 tuyệt chiêu khuyến mại - được đúc kết qua nhiều năm kinh nghiệm của bản thân tác giả. Nhanh chóng tăng doanh thu lên gấp nhiều lần hiện tại. Chiến lược lâu dài cho việc kinh doanh phát triển hơn,Chiến lược bán hàng
https://unica.vn/dot-pha-doanh-thu-voi-06-kenh-marketing-pho-bien-nhat,Đột phá thu nhập 06 kênh marketing online,Vũ Ngọc Quyền,700.000,149.000,3477,4.7,11 phần,153 bài giảng,28 giờ 56 phút,"Hệ thống Toàn bộ Kiến thức Cốt lõi và Quan trọng nhất trong Khởi nghiệp Online. Xác định Sản phẩm kinh doanh phù hợp, Mô hình bạn sẽ Kinh doanh. Có được Nguồn hàng kinh doanh khi liên hệ trực tiếp với người bán, nhà cung cấp. Nhận diện chân dung khách hàng Tiềm năng, chăm sóc khách hàng bài bản. Cách nghiên cứu, học hỏi từ Đối thủ cạnh tranh qua các công cụ Miễn phí bí mật. Tìm kiếm các nguồn nội dung Fanpage tự động, bài bản.. Từng bước bài bản Triển khai đồng loạt kênh Marketing Online. Facebook Marketing - Đa nhiệm Phân tích khách hàng, đối thủ. Instagram Marketing - Xu hướng Giới trẻ. Zalo Marketing - Xu hướng phát triển. Youtube Marketing - Video Marketing lên ngôi. Email Marketing - Xây dựng chuỗi Email chuyên nghiệp",Marketing Online
https://unica.vn/affiliate-summit-2017,AFFILIATE SUMMIT 2017,Đội ngũ Unica,1.000.000,0,3869,4.9,2 phần,26 bài giảng,11 giờ 00 phút,"Tự xây dựng chương trình affiliate và tích hợp vào website của bạn. Các phương pháp tăng traffic và danh sách khách hàng tiềm năng. Hiểu rõ về các mô hình affiliate trên thế giới và tại việt nam. Biết cách tối ưu traffic, thu nhập, tăng giá trị vòng đời 1 khách hàng. Trải nghiệm kiếm tiền với affiliate: youtube, clickbank, amazon, lazada. Nhanh chóng tăng doanh thu với chi phí thấp nhất",Affiliate Marketing
https://unica.vn/tu-chay-quang-cao-facebook-cho-nguoi-moi-bat-dau-cap-nhat,Tự chạy quảng cáo Facebook cho người mới bắt đầu,Hoàng Minh Quý,800.000,299.000,1494,4.4,8 phần,40 bài giảng,03 giờ 32 phút,"Hiểu được bản chất cách chạy quảng cáo Facebook. Học chạy quảng cáo facebook cho người mới bắt đầu một cách hiệu quả, đúng quy trình. Biết cách lựa chọn sản phẩm phù hợp với bạn, đặc biệt với những bạn mới bắt đầu kinh doanh online. Biết cách viết Content cho từng loại đối tượng khác nhau sao cho thu hút, ấn tượng và chốt đơn nhanh nhất. Biết cách đi tìm và sáng tạo hình ảnh thu hút, hợp quy định quảng cáo Facebook. Biết cách vẽ chân dung khách hàng tiềm năng chính xác cho sản phẩm của bạn. Chạy quảng cáo trên Trình quản lý quảng cáo và Power Editor. Khóa học chạy quảng cáo cho người mới bắt đầu giúp bạn tự quảng cáo mà không phải đi thuê dịch vụ bên ngoài. Gia tăng doanh số bán hàng gấp x2 - x5 một cách  nhanh chóng, hiệu quả và thành công","Facebook Marketing, Marketing Online"
https://unica.vn/19-chien-luoc-xay-dung-mang-luoi-network-marketing,19 Chiến lược xây dựng mạng lưới Network Marketing,Lê Minh Tuấn,1.000.000,399.000,1393,4.6,3 phần,27 bài giảng,01 giờ 48 phút,"Hiểu được tầm quan trọng của mạng lưới kinh doanh và những kỹ năng để duy trì mạng lưới. Nắm rõ nguyên tắc để đạt hiệu quả kinh doanh thông qua xây dựng mạng lưới kinh doanh. Xác lập cụ thể mục tiêu trong xây dựng mạng lưới kinh doanh.. Duy trì phát triển mạng lưới kinh doanh bền vững, hiệu quả",Chiến lược Marketing
https://unica.vn/xay-dung-thuong-hieu-ca-nhan-va-doanh-nghiep,Xây dựng thương hiệu cá nhân và doanh nghiệp,Nguyễn Bá Dương,800.000,299.000,251,4.7,4 phần,34 bài giảng,02 giờ 16 phút,Hiểu rõ về thương hiệu và tầm quan trọng của thương hiệu.. Nâng tầm thương hiệu cá nhân/ doanh nghiệp tạo sự uy tín. Biết được các nguyên tắc và cách xây dựng một thương hiệu riêng biệt và độc đáo.. Các lỗi nên tránh trong xây dựng thương hiệu để không vi phạm về thương hiệu.. Giúp doanh nghiệp tiếp thị tốt hơn và đây là cơ sở để xây dựng hình ảnh thương hiệu nổi tiếng. Giúp bạn sở hữu một tài sản được bảo hộ là tạo ra một tài sản kinh doanh có giá trị và thu hút được đầu tư,"Branding, Thương hiệu cá nhân, Xây dựng thương hiệu"
https://unica.vn/gap-doi-doanh-so-ban-hang-voi-facebook-chatbot,Gấp ĐÔI doanh số bán hàng với Facebook Chatbot,Tú Michael,900.000,299.000,164,4.7,6 phần,31 bài giảng,03 giờ 20 phút,"Nắm được tiềm năng tuyệt vời mà Facebook Chatbot. Nhanh chóng thành thạo sử dụng Facebook Chatbot ứng dụng vào công việc bán hàng đỉnh cao của bạn. Sớm tăng hiệu quả của việc chạy quảng cáo Facebook và khả năng chốt đơn tốt. Nhanh chóng tăng gấp đôi doanh thu bằng tự động hóa chat bot. Tối ưu chi phí quảng cáo, cắt giảm chi phí marketing. Giúp bạn tiếp cận đến hàng nghìn khách hàng tiềm năng khác cũng như resale khách hàng cũ","Facebook Marketing, Marketing Online, Chatbot"
https://unica.vn/28-y-tuong-lam-video-marketing,28 Ý tưởng làm video Marketing,Nguyễn Anh Dũng,600.000,299.000,305,4.8,2 phần,34 bài giảng,01 giờ 23 phút,"Kỹ thuật xây dựng kịch bản video quảng cáo. Khiến khách hàng nhanh chóng bị ấn tượng. Tiết kiệm chi phí quảng cáo hơn, hiệu quả cao hơn. Sở hữu được kênh truyền thông riêng","Marketing Online, Video marketing"
https://unica.vn/hoc-lam-video-marketing-cho-nguoi-moi-bat-dau,Học làm Video Marketing cho người mới bắt đầu,Văn Thượng Hỉ,700.000,299.000,400,4.2,6 phần,55 bài giảng,03 giờ 24 phút,Sau khi học xong khóa học bạn sẽ:. Tạo ra hàng trăm video giá trị cho khách hàng. Bạn sẽ không bao giờ sợ quay video thêm một lần nào nữa. Bạn sẽ sáng tạo ra những ý tưởng quay video. Bạn sẽ nắm vững kỹ năng Body language trong video. Bạn sẽ sở hữu kỹ năng thuyết trình chuyên nghiệp,"Marketing Online, Video marketing"
https://unica.vn/40-tuyet-chieu-khuyen-mai-tang-qua-va-giam-gia,"40 Tuyệt chiêu khuyến mại, tặng quà và giảm giá",Tuấn Hà,800.000,299.000,514,4.9,1 phần,40 bài giảng,01 giờ 51 phút,"Những chiêu thức nâng cao về Tặng quà, giảm giá, khuyến mại. Thu hút khách hàng tiềm năng nhanh chóng. Giữ chân khách hàng khiến họ luôn trung thành với sản phẩm. Nhanh chóng tăng doanh thu, mang lại ảnh hưởng tích cực",Chiến lược bán hàng
https://unica.vn/ban-hang-bang-video-marketing-va-livestream,Bán hàng bằng video marketing và livestream,Văn Thượng Hỉ,800.000,299.000,490,4.3,5 phần,39 bài giảng,02 giờ 24 phút,Tự tạo cho mình hàng trăm video bán hàng. Livestream với hàng trăm nghìn lượt xem. Xây dựng được thương hiệu cá nhân facebook. Nắm vững kỹ năng body language trong video. Số lượng khách hàng đông đảo trên internet. Doanh thu cao mà không mất chi phí quảng cáo,"Video marketing, Bán hàng livestream"
https://unica.vn/32-tuyet-chieu-khuyen-mai-qua-tang-va-giam-gia,"32 Tuyệt chiêu khuyến mại, quà tặng và giảm giá",Tuấn Hà,800.000,299.000,334,4.6,1 phần,34 bài giảng,02 giờ 03 phút,Nhận ra những chiêu thức khuyến mại thu hút khách hàng không quá khó khăn. 32 tuyệt chiêu khuyến mại - được đúc kết qua nhiều năm kinh nghiệm của bản thân tác giả. Nhanh chóng tăng doanh thu lên gấp nhiều lần hiện tại. Chiến lược lâu dài cho việc kinh doanh phát triển hơn,Chiến lược bán hàng
